soc,task_id,junior,mid,senior,principal,rationale
15-1252.00,21661,0.1,0.4,0.8,0.95,"Analyzing systems to recommend and plan installations or modifications is primarily a senior and principal-level responsibility involving design judgment, architectural analysis, and strategic planning, while junior engineers rarely own such analysis and mid-level engineers participate with some scope constraints."
15-1252.00,21662,0.1,0.5,0.85,0.9,"Analyzing feasibility of design within time and cost constraints is primarily a senior+ responsibility requiring broad technical judgment, though mid-level engineers begin contributing to this at the feature level while juniors rarely do it independently."
15-1252.00,21663,0.2,0.5,0.75,0.6,"Conferring with project managers and data processing stakeholders about limitations and capabilities is primarily a mid-to-senior activity requiring enough technical context and autonomy to gather and interpret cross-functional constraints, while juniors rarely initiate such conversations independently."
15-1252.00,21664,0.2,0.6,0.9,0.85,"Cross-functional conferring to design systems and gather requirements scales strongly with seniority, being occasional for juniors (who mostly receive specs), routine for mid-levels owning features, and central to the daily work of seniors and principal/staff engineers driving subsystem and organizational design."
15-1252.00,21665,0.1,0.4,0.75,0.9,"Consulting with customers and cross-departmental stakeholders on design and proposals scales strongly with seniority, as juniors rarely interface externally while seniors and principals regularly drive such technical discussions."
15-1252.00,21666,0.2,0.5,0.6,0.3,"Coordinating software system installation is most characteristic of mid-to-senior engineers who own end-to-end feature or subsystem delivery, while juniors rarely lead such coordination and principals focus on higher-level architecture rather than hands-on installation logistics."
15-1252.00,21667,0.1,0.35,0.75,0.85,"Using scientific analysis and mathematical models to predict and measure design outcomes is predominantly a senior/principal activity requiring deep design ownership, while juniors primarily implement from specs and mid-levels apply established patterns with limited modeling."
15-1252.00,21668,0.05,0.25,0.7,0.9,"Determining system performance standards is a design and architectural concern that primarily falls to senior and principal engineers who own subsystems and set cross-organizational technical strategy, while junior and mid-level engineers typically implement against already-defined standards."
15-1252.00,21669,0.3,0.6,0.85,0.7,"Developing and directing testing/validation procedures and documentation scales with seniority—juniors follow existing procedures, mid-levels own feature-level testing end-to-end, seniors design subsystem-level validation strategies, and principals set organizational testing standards, though direct hands-on involvement tapers slightly at the principal level in favor of directing others."
15-1252.00,21670,0.7,0.9,0.8,0.4,"Modifying existing software to fix bugs, adapt to hardware, and improve performance is core daily work across all levels, peaking at mid-level where independent ownership of such tasks is the primary expectation, while principals focus more on architecture and strategy than hands-on code modification."
15-1252.00,21671,0.2,0.5,0.7,0.4,"Monitoring system conformance to specifications peaks at the senior level where owning subsystem reliability and debugging complex distributed issues is core, while juniors rarely own this responsibility independently and principals delegate it but care about it strategically."
15-1252.00,21672,0.05,0.2,0.5,0.7,"Evaluating hardware configuration factors like costs, security, and reporting formats is primarily a design/architecture concern that grows with seniority, most characteristic of senior and principal engineers who make infrastructure and system-level decisions."
15-1252.00,21673,0.2,0.5,0.75,0.85,"Preparing reports and project correspondence scales strongly with seniority, as senior and principal engineers routinely produce design docs, status updates, and cross-team specifications, while juniors primarily consume rather than author such artifacts."
15-1252.00,21674,0.03,0.06,0.12,0.18,This infrastructure/facilities advisory task is atypical for software developers at any level but marginally more plausible for senior/principal engineers who engage in system deployment planning and cross-functional decision-making.
15-1252.00,21675,0.05,0.1,0.2,0.25,"Specifying power supply requirements is a hardware/embedded systems or data center infrastructure concern that rarely falls to typical software developers at any tier, but is slightly more likely to appear in senior/principal roles working on embedded, IoT, or hardware-adjacent systems architecture."
15-1252.00,21676,0.6,0.75,0.65,0.35,"Data storage and retrieval for system analysis is a routine but essential engineering task performed most heavily at mid-level where engineers own feature-level work end-to-end, while juniors do it under guidance, seniors do it as part of broader subsystem design, and principals engage with it only at a strategic/architectural level."
15-1252.00,21677,0.02,0.08,0.35,0.55,"Supervising and assigning work to other technical personnel is primarily a management/leadership responsibility that becomes increasingly relevant at Senior and Principal levels, where mentoring, delegation, and coordination across teams are expected, but is rarely done by Junior or Mid-level individual contributors."
15-1252.00,21678,0.02,0.08,0.35,0.55,"Formal supervision of programmers and technical personnel is primarily a responsibility that emerges at senior and principal/staff levels, where individuals lead teams and guide the work of others, rather than at junior or mid levels where the focus is on individual contribution."
15-1252.00,21679,0.1,0.2,0.3,0.2,"Training users on equipment is atypical for software developers at any level, as it resembles an IT support or technical trainer role rather than core software development work, though senior engineers occasionally conduct knowledge-transfer sessions when rolling out new systems."
15-1253.00,14642,0.95,0.85,0.6,0.25,"Identifying, analyzing, and documenting program defects is a core daily activity for junior and mid-level QA roles, remains relevant but less dominant for seniors who focus on systemic quality strategy, and is only incidentally performed by principal/staff engineers who operate at architectural and organizational levels."
15-1253.00,14641,0.95,0.75,0.4,0.1,"Bug documentation and defect reporting is a core routine task most characteristic of junior QA roles, still relevant at mid-level, but decreasingly so at senior and principal levels where work shifts toward strategy, architecture, and process design."
15-1253.00,14640,0.5,0.85,0.75,0.3,"Developing comprehensive testing programs is most characteristic of mid-level QA engineers who own feature-level testing end-to-end, while juniors execute assigned test cases, seniors focus more on subsystem strategy and architecture, and principals operate at an organizational/strategic level where hands-on test program development is less frequent."
15-1253.00,14638,0.4,0.8,0.7,0.3,"Designing test plans and procedures is core mid-level QA work where engineers own feature-level testing end-to-end, while juniors execute existing scripts, seniors focus on subsystem/strategy-level test architecture, and principals rarely engage at this tactical level."
15-1253.00,14648,0.8,0.75,0.5,0.2,"Documenting test procedures is a foundational QA task most heavily associated with junior and mid-level engineers who own day-to-day testing work, while seniors may establish standards and principals rarely engage in this directly."
15-1253.00,14653,0.5,0.8,0.7,0.3,"Providing feedback and recommendations to developers on usability and functionality is a core QA responsibility most characteristic of mid-level analysts who independently own feature-level quality, while juniors do it in limited scope, seniors do it cross-team with broader influence, and principals rarely focus on this tactical activity."
15-1253.00,14652,0.85,0.8,0.55,0.2,"Installing, maintaining, and using software testing programs is a hands-on, day-to-day task most characteristic of junior and mid-level QA roles, while seniors do it less frequently as they shift toward design and oversight, and principals rarely engage in direct tool usage."
15-1253.00,14639,0.85,0.8,0.55,0.2,"Testing system modifications before implementation is core hands-on QA work most characteristic of junior and mid-level roles, while seniors may do it selectively for complex subsystems and principals rarely perform it directly."
15-1253.00,14644,0.8,0.7,0.4,0.1,"Maintaining defect databases is a foundational QA task most characteristic of junior and mid-level testers, less so for seniors who may oversee the process, and rarely a principal-level concern."
15-1253.00,14649,0.05,0.25,0.7,0.85,"Defining quality standards, release criteria, and QA methodologies is primarily a senior/principal-level responsibility requiring broad technical judgment and cross-team influence, while juniors follow existing standards rather than creating them."
15-1253.00,14643,0.2,0.6,0.8,0.5,"Monitoring and tracking bug resolution is primarily an ownership-level responsibility, peaking at Senior where cross-team coordination and subsystem accountability make systematic tracking essential, with Mid-Level also doing this within their feature scope, while Juniors mainly fix assigned bugs rather than track them, and Principals engage at a higher strategic level rather than day-to-day bug tracking."
15-1253.00,14650,0.85,0.75,0.35,0.05,"Updating existing automated test scripts to keep them current is a routine maintenance task most characteristic of junior and mid-level QA engineers, while seniors may do it occasionally for complex subsystems and principals rarely engage in hands-on script maintenance."
15-1253.00,14646,0.2,0.6,0.85,0.75,"Participating in design reviews to provide QA input on requirements and potential problems scales strongly with seniority, as juniors mostly execute test plans while mid-level and above engineers are expected to engage proactively in design and planning discussions."
15-1253.00,14645,0.15,0.55,0.8,0.4,"Test planning and strategy aligned with project scope and delivery dates is primarily a senior QA responsibility requiring cross-team coordination and judgment, with mid-level contributors owning feature-level test planning and juniors largely executing rather than planning schedules."
15-1253.00,14654,0.4,0.65,0.8,0.5,"Performance monitoring is a core responsibility that scales with seniority—juniors do it under guidance on limited scope, mid-levels own it for their features, seniors drive it across subsystems with deep diagnostic authority, while principals are more focused on architectural strategy than hands-on monitoring."
15-1253.00,14655,0.85,0.7,0.4,0.1,"Compatibility testing is a hands-on execution task most characteristic of junior and mid-level QA roles, diminishing at senior and principal levels where work shifts toward test strategy, architecture, and cross-org leadership."
15-1253.00,14651,0.5,0.7,0.5,0.2,"Investigating customer-reported problems is core QA/mid-level work done independently, occasionally touched by juniors under guidance and seniors for complex issues, but rarely a principal-level responsibility."
15-1253.00,14647,0.5,0.7,0.8,0.5,"Reviewing documentation for accuracy and compliance is a core QA activity that peaks at mid-to-senior levels where engineers own features end-to-end and subsystem design, while juniors do it in limited scope and principals focus more on architectural strategy than documentation review."
15-1253.00,14658,0.5,0.8,0.7,0.4,"Identifying deviations from standards and suggesting fixes is core QA/mid-level work done independently at mid and senior levels, done with guidance at junior level, and delegated or handled strategically rather than hands-on at principal level."
15-1253.00,14661,0.7,0.9,0.8,0.4,"Initial debugging via logs, configs, and code is core daily work for mid-level QA engineers and common for juniors and seniors, but principal/staff engineers rarely perform this hands-on triage themselves, focusing instead on architectural and strategic concerns."
15-1253.00,14659,0.3,0.7,0.8,0.4,"Designing and developing automated testing tools is most characteristic of mid-level and senior engineers who own feature/subsystem-level work and apply design judgment, while juniors may contribute to existing tools under guidance and principals focus more on strategy than hands-on tool development."
15-1253.00,14656,0.6,0.75,0.5,0.15,"Setting up and configuring test environment reproductions is a hands-on operational task most characteristic of mid-level QA engineers who own feature-level testing end-to-end, done frequently by juniors under guidance, occasionally by seniors overseeing complex environments, and rarely by principal-level staff who focus on strategy and architecture."
15-1253.00,14657,0.2,0.5,0.75,0.6,"Collaborating with field staff or customers to diagnose problems and recommend solutions is primarily a mid-to-senior level activity, as it requires independent judgment and communication skills beyond what juniors typically exercise, while principals do it more strategically and less directly."
15-1253.00,14660,0.1,0.5,0.75,0.4,"Coordinating user or third-party testing requires cross-team communication and ownership that is most characteristic of senior engineers, moderately present at mid-level, rarely assigned to juniors who follow rather than coordinate, and less central to principal/staff work which focuses on architecture and strategy."
15-1253.00,14662,0.3,0.5,0.5,0.2,"Visiting beta testing sites is a field-facing QA activity most characteristic of mid-level and senior QA roles who own end-to-end feature validation and external stakeholder collaboration, less common for juniors still learning and rare for principal-level staff focused on strategy."
15-1253.00,14664,0.3,0.6,0.7,0.4,"Historical analysis of test results is most characteristic of mid-to-senior QA work where engineers own quality metrics, identify trends, and drive process improvements, while juniors do it minimally under guidance and principals engage with it only at a strategic/organizational level."
15-1253.00,14663,0.1,0.35,0.65,0.55,"Evaluating and recommending tooling requires design judgment and organizational influence, making it primarily a Senior/Principal activity, though Mid-level engineers may participate in tool evaluations while Juniors rarely drive such decisions."
15-1253.00,21680,0.2,0.5,0.6,0.3,"Modifying existing software to correct errors or improve performance is primarily a mid-to-senior SWE activity that goes beyond typical QA scope, with mid-level owning bug fixes end-to-end and seniors handling performance engineering, while juniors rarely do this independently and principals focus on architecture rather than hands-on code modification."
15-1253.00,21681,0.03,0.06,0.12,0.15,"This facilities/infrastructure procurement task is largely outside typical software QA roles at any tier, but if it appears at all it would be more associated with senior or principal engineers who make equipment and environment decisions rather than junior implementers."
15-1253.00,21682,0.6,0.75,0.55,0.25,"Data manipulation for system capability analysis is a core QA/testing activity most characteristic of mid-level analysts who own feature-level testing end-to-end, moderately common for juniors executing assigned test data tasks and seniors analyzing complex system requirements, but rarely a primary focus for principal-level staff who operate at architectural and strategic levels."
15-1254.00,14707,0.95,0.9,0.7,0.35,"Writing supporting code for web applications is core work at junior and mid levels, remains significant for seniors, but becomes a smaller fraction of principal/staff work which shifts toward architecture, strategy, and organizational leadership."
15-1254.00,14694,0.95,0.9,0.65,0.25,"Hands-on web design and building is core work for junior and mid-level developers, remains part of senior work at a higher level, but is largely delegated away at principal/staff roles where focus shifts to architecture and strategy."
15-1254.00,14698,0.6,0.4,0.15,0.05,"Backing up website files is a routine, operational task most commonly assigned to junior or mid-level developers as part of maintenance duties, and rarely falls to senior or principal engineers who focus on higher-level architecture and strategy."
15-1254.00,14711,0.1,0.35,0.65,0.85,"Technology and tool selection is primarily a senior/principal responsibility, as juniors work within pre-selected stacks and mid-levels make limited design choices within established patterns, while seniors and principals formally evaluate and decide on languages, frameworks, and tooling."
15-1254.00,14700,0.7,0.9,0.7,0.3,"Code evaluation for validity, standards compliance, and cross-browser/device compatibility is a core daily activity most prominent at mid-level where engineers own features end-to-end, still common for juniors learning best practices and seniors reviewing others' work, but less characteristic of principal/staff roles focused on architecture and strategy."
15-1254.00,14704,0.5,0.8,0.7,0.3,"Database development for web apps is core mid-level work done end-to-end, touched by juniors on assigned components and seniors in subsystem design, but rarely a principal-level focus since it lacks the cross-org strategic scope typical of that tier."
15-1254.00,14710,0.8,0.7,0.4,0.1,"Routine website testing is a core hands-on task most characteristic of junior and mid-level developers who execute scheduled QA work, while seniors may oversee or design test strategies and principals rarely perform this directly."
15-1254.00,14695,0.85,0.75,0.45,0.15,"Performing website updates is core hands-on work most characteristic of junior and mid-level developers, while seniors do so less frequently and principals rarely perform updates directly, instead setting technical direction."
15-1254.00,14701,0.5,0.7,0.85,0.9,"Continuous learning of web technologies is expected at all levels but becomes increasingly characteristic at higher tiers where engineers must evaluate emerging technologies, set technical direction, and engage with the broader engineering community."
15-1254.00,14702,0.2,0.65,0.8,0.7,"Analyzing user needs to determine technical requirements scales upward with seniority—juniors primarily receive pre-analyzed specs, while mid-level and above increasingly own the translation from user/product needs into technical requirements, with seniors and principals doing so at broader scope and organizational impact."
15-1254.00,14723,0.25,0.45,0.35,0.1,"Monitoring security logs and escalating issues is a routine operational task most characteristic of mid-level web developers who own systems end-to-end, but is too mechanical for senior/principal focus and slightly above typical junior responsibilities."
15-1254.00,14713,0.4,0.35,0.15,0.05,"Responding to user email inquiries or setting up automated email response systems is a routine, operational task more characteristic of junior/mid-level web developers (especially in smaller teams or agencies) and diminishes in relevance at senior and principal levels where strategic and architectural concerns dominate."
15-1254.00,14705,0.3,0.3,0.15,0.05,"Domain renewal is an administrative/operational task that any team member might handle occasionally but is not characteristic of engineering work at any level, being more of a DevOps or IT admin responsibility."
15-1254.00,14697,0.1,0.4,0.75,0.9,"Conferring with management and development teams to prioritize needs, resolve conflicts, and choose solutions is increasingly characteristic at higher seniority levels, where cross-team collaboration and technical decision-making are core responsibilities, while juniors rarely participate in such discussions."
15-1254.00,14708,0.4,0.6,0.4,0.1,"Coordinating with hosting/network personnel on hardware or software issues is primarily a mid-level operational responsibility, sometimes handled by juniors under guidance, occasionally by seniors during incidents, but rarely by principal engineers who operate at a strategic/architectural level."
15-1254.00,14706,0.05,0.25,0.55,0.7,"Collaborating with management to develop and integrate e-commerce strategies is primarily a senior/principal-level responsibility requiring cross-team communication, strategic thinking, and system-level design judgment, rarely expected of junior engineers who work from specs."
15-1254.00,14726,0.4,0.7,0.6,0.2,"Documenting test plans and results is most characteristic of mid-level engineers who own features end-to-end, moderately relevant for seniors overseeing subsystem quality, occasionally done by juniors following guidance, and rarely a focus for principal/staff who operate at architectural and strategic levels."
15-1254.00,14717,0.5,0.6,0.3,0.1,"Setting up server directory trees is a practical, implementation-level task most commonly handled by mid-level developers owning feature/deployment work end-to-end, occasionally assigned to juniors following guidance, but rarely a focus for seniors or principals who operate at higher architectural levels."
15-1254.00,14719,0.2,0.6,0.9,0.6,"Performance improvement is a core senior engineering responsibility, moderately present at mid-level for feature-scoped optimizations, rare for juniors who mostly implement under guidance, and somewhat present at principal level though their focus shifts more toward architecture and strategy."
15-1254.00,14728,0.3,0.6,0.7,0.4,"Documenting technical performance factors like server load and database performance is primarily a mid-to-senior level responsibility, as juniors rarely own this systematically while principals delegate such documentation to others."
15-1254.00,14714,0.1,0.4,0.75,0.5,"Developing and implementing revision procedures is primarily a Senior-level concern involving subsystem ownership and process design, with Mid-levels executing within established patterns and Principals occasionally setting broader technical strategy around it."
15-1254.00,14724,0.4,0.8,0.7,0.4,"Creating web models and prototypes is most characteristic of mid-level developers who translate requirements into concrete designs, remains relevant for seniors doing subsystem design, is occasionally done by juniors under guidance, but is less central to principal/staff work which focuses on broader architecture and strategy."
15-1254.00,14722,0.2,0.6,0.8,0.5,"Writing clear website specifications is primarily a mid-to-senior activity, as it requires enough system knowledge and design judgment to translate requirements into detailed technical specs, while juniors mostly consume specs and principals focus on broader architecture and strategy rather than feature-level documentation."
15-1254.00,14725,0.05,0.2,0.55,0.8,"Evaluating and recommending server hardware/software is primarily a senior-to-principal concern, as it requires broad architectural judgment and technology strategy experience, while juniors rarely have the context or authority to make such recommendations."
15-1254.00,14729,0.35,0.45,0.35,0.1,"HTTP server installation and configuration is a hands-on infrastructure/DevOps task most commonly handled by mid-level or occasionally junior web developers in smaller organizations, but becomes less characteristic at senior and principal levels where focus shifts to architecture and strategy rather than direct server setup."
15-1254.00,14727,0.1,0.35,0.75,0.95,"Researching, documenting, and selecting web architecture alternatives is primarily a senior-to-principal activity involving design judgment and technology strategy, though mid-levels may participate in evaluation and juniors rarely do so independently."
15-1254.00,14730,0.1,0.45,0.75,0.55,"Creating system interaction and sequence diagrams is primarily a Senior-level activity tied to subsystem design ownership, moderately common at Mid-level for feature design, rare for Juniors who work from existing specs, and done at Principal level but often at a higher architectural abstraction."
15-1254.00,21683,0.2,0.55,0.75,0.4,"Designing and implementing security measures like firewalls and encryption is primarily a senior-level responsibility requiring subsystem-level design judgment, though mid-level engineers may implement specific security features within established patterns, juniors rarely own this work, and principals are more likely to set strategy than implement directly."
15-1254.00,21684,0.1,0.5,0.8,0.6,"Incorporating technical constraints like performance, accessibility, privacy, and budget into design plans is primarily a mid-to-senior responsibility requiring design judgment and cross-functional awareness, with juniors rarely owning such decisions and principals operating at a higher strategic level."
